<?xml version="1.0" ?>
<ProblemDefinition xmlns:xsi="http://www.w3.org/2001/XMLSchema-instance"
	xsi:noNamespaceSchemaLocation="ProblemDefinition.xsd">
	<events>
	    <event type="invoke" name="runPersona" label="runPersona" />
	    <event type="invoke" name="runAscensor" label="runAscensor" />
	    <event type="invoke" name="runControlador" label="runControlador" />

	    <event type="invoke" name="subir" label="subir" />
	    <event type="invoke" name="bajar" label="bajar" />
	    <event type="invoke" name="continuarSubir" label="continuarSubir" />
	    <event type="invoke" name="continuarBajar" label="continuarBajar" />

		<!-- para quedar fuera del ctx -->
	    <event type="invoke" name="terminoPersona" label="terminoPersona" />

	    <event type="invoke" name="solicitudAscensorPiso4" label="solicitudAscensorPiso4" />
	    <event type="invoke" name="atenderSolicitudPiso4" label="atenderSolicitudPiso4" />
	</events>
</ProblemDefinition>